{
  "$schema": "https://json-schema.org/draft/2020-12/schema",
  "$id": "https://xshell.dev/schemas/x-schema.schema.json",
  "title": "X-Schema",
  "description": "Declarative specification for rendering and editing structured object values in XShell.",
  "type": "object",
  "additionalProperties": false,
  "required": ["version", "types", "root"],
  "properties": {
    "version": { "type": "string", "const": "0" },
    "meta": { "$ref": "#/$defs/meta" },
    "root": {
      "type": "string",
      "minLength": 1,
      "description": "Name of the root object type declared in types. The referenced type must exist; this is enforced by X-Schema semantic validation."
    },
    "types": {
      "type": "object",
      "minProperties": 1,
      "description": "Named reusable or recursive object type definitions.",
      "additionalProperties": { "$ref": "#/$defs/objectType" }
    }
  },

  "$defs": {
    "node": {
      "description": "Any node allowed in an object or container children collection.",
      "oneOf": [
        { "$ref": "#/$defs/dataNode" },
        { "$ref": "#/$defs/containerNode" }
      ]
    },

    "dataNode": {
      "description": "Node representing a data value. Unlike node, this excludes presentation-only containers and is therefore suitable for array items.",
      "oneOf": [
        { "$ref": "#/$defs/objectReference" },
        { "$ref": "#/$defs/fieldNode" },
        { "$ref": "#/$defs/objectNode" },
        { "$ref": "#/$defs/arrayNode" }
      ]
    },

    "objectReference": {
      "type": "object",
      "additionalProperties": false,
      "required": ["type"],
      "description": "Contextual use of a named object type. The referenced type supplies the reusable object structure; the reference supplies binding, presentation and behavior for this use.",
      "properties": {
        "type": {
          "type": "string",
          "minLength": 1,
          "description": "Name of an object type declared in the top-level types registry. The referenced type must exist; this is enforced by X-Schema semantic validation."
        },
        "bind": { "$ref": "#/$defs/bind" },
        "required": {
          "type": "boolean",
          "default": false,
          "description": "Static required state for the referenced value. A conditions.required rule, when present, dynamically overrides this value."
        },
        "attrs": {
          "$ref": "#/$defs/attributes",
          "description": "Attributes for this use of the referenced object type."
        },
        "props": {
          "$ref": "#/$defs/properties",
          "description": "Component properties for this use of the referenced object type."
        },
        "conditions": {
          "$ref": "#/$defs/conditions",
          "description": "Dynamic conditions for this use of the referenced object type."
        },
        "create": {
          "$ref": "#/$defs/jsonValue",
          "description": "Context-specific creation value. When present, replaces the creation value declared by the referenced object type."
        },
        "meta": {
          "$ref": "#/$defs/meta",
          "description": "Metadata for this use of the referenced object type."
        }
      }
    },

    "objectType": {
      "type": "object",
      "additionalProperties": false,
      "required": ["kind", "children"],
      "description": "Named reusable object structure. Presentation and contextual behavior belong on object references rather than on the type.",
      "properties": {
        "kind": { "const": "object" },
        "description": { "type": "string" },
        "children": { "$ref": "#/$defs/children" },
        "create": {
          "$ref": "#/$defs/jsonValue",
          "description": "Default value used when creating an instance of this object type."
        },
        "meta": { "$ref": "#/$defs/meta" }
      }
    },

    "objectNode": {
      "type": "object",
      "additionalProperties": false,
      "required": ["kind", "children"],
      "description": "Inline object node. When bind is omitted, the object operates on the current data-context value.",
      "properties": {
        "kind": { "const": "object" },
        "bind": { "$ref": "#/$defs/bind" },
        "required": {
          "type": "boolean",
          "default": false,
          "description": "Static required state for the object value. A conditions.required rule, when present, dynamically overrides this value."
        },
        "description": { "type": "string" },
        "tag": { "type": "string", "minLength": 1 },
        "attrs": { "$ref": "#/$defs/attributes" },
        "props": { "$ref": "#/$defs/properties" },
        "children": { "$ref": "#/$defs/children" },
        "create": {
          "$ref": "#/$defs/jsonValue",
          "description": "Value used when creating or activating this object."
        },
        "conditions": { "$ref": "#/$defs/conditions" },
        "meta": { "$ref": "#/$defs/meta" }
      }
    },

    "fieldNode": {
      "type": "object",
      "additionalProperties": false,
      "required": ["kind"],
      "description": "Editable atomic value. When bind is omitted, the field edits the current data-context value itself.",
      "properties": {
        "kind": { "const": "field" },
        "bind": { "$ref": "#/$defs/bind" },
        "required": {
          "type": "boolean",
          "default": false,
          "description": "Static required state for the field value. A conditions.required rule, when present, dynamically overrides this value."
        },
        "description": { "type": "string" },
        "dataType": { "$ref": "#/$defs/dataType" },
        "tag": { "type": "string", "minLength": 1 },
        "attrs": { "$ref": "#/$defs/attributes" },
        "props": { "$ref": "#/$defs/properties" },
        "default": {
          "$ref": "#/$defs/jsonValue",
          "description": "Default value used when the field value has not otherwise been initialized."
        },
        "reference": { "$ref": "#/$defs/dataReference" },
        "conditions": { "$ref": "#/$defs/conditions" },
        "meta": { "$ref": "#/$defs/meta" }
      }
    },

    "arrayNode": {
      "type": "object",
      "additionalProperties": false,
      "required": ["kind", "item"],
      "description": "Ordered collection of data values. When bind is omitted, the array operates on the current data-context value.",
      "properties": {
        "kind": { "const": "array" },
        "bind": { "$ref": "#/$defs/bind" },
        "required": {
          "type": "boolean",
          "default": false,
          "description": "Static required state for the array value. A conditions.required rule, when present, dynamically overrides this value."
        },
        "description": { "type": "string" },
        "tag": { "type": "string", "minLength": 1 },
        "attrs": { "$ref": "#/$defs/attributes" },
        "props": { "$ref": "#/$defs/properties" },
        "item": {
          "$ref": "#/$defs/dataNode",
          "description": "Definition of each array item. Presentation-only container nodes are not valid array items."
        },
        "allowAdd": {
          "type": "boolean",
          "default": true,
          "description": "Whether users may add array items."
        },
        "allowRemove": {
          "type": "boolean",
          "default": true,
          "description": "Whether users may remove array items."
        },
        "allowMove": {
          "type": "boolean",
          "default": false,
          "description": "Whether users may reorder array items."
        },
        "minItems": {
          "type": "integer",
          "minimum": 0,
          "description": "Minimum number of items. When maxItems is also present, minItems must not exceed it; this is enforced by X-Schema semantic validation."
        },
        "maxItems": {
          "type": "integer",
          "minimum": 0,
          "description": "Maximum number of items. When minItems is also present, it must not exceed maxItems; this is enforced by X-Schema semantic validation."
        },
        "default": {
          "type": "array",
          "description": "Default array value used when the array has not otherwise been initialized."
        },
        "conditions": { "$ref": "#/$defs/conditions" },
        "meta": { "$ref": "#/$defs/meta" }
      }
    },

    "containerNode": {
      "type": "object",
      "additionalProperties": false,
      "required": ["kind", "tag", "children"],
      "description": "Presentation-only node used to compose child nodes. Containers do not bind data and do not establish a new data context.",
      "properties": {
        "kind": { "const": "container" },
        "description": { "type": "string" },
        "tag": { "type": "string", "minLength": 1 },
        "attrs": { "$ref": "#/$defs/attributes" },
        "props": { "$ref": "#/$defs/properties" },
        "children": { "$ref": "#/$defs/children" },
        "conditions": { "$ref": "#/$defs/conditions" },
        "meta": { "$ref": "#/$defs/meta" }
      }
    },

    "children": {
      "type": "array",
      "items": { "$ref": "#/$defs/node" }
    },

    "bind": {
      "type": "string",
      "minLength": 1,
      "description": "Path relative to the current data context. Scoped paths may use $current, $parent or $root. When a data node omits bind, it operates directly on the current data-context value."
    },

    "dataType": {
      "description": "Logical value type edited by a field. object and array are allowed for field components that edit those values atomically, such as a JSON editor.",
      "enum": ["string", "number", "integer", "boolean", "date", "datetime", "time", "object", "array", "any"]
    },

    "conditions": {
      "type": "object",
      "additionalProperties": false,
      "description": "Dynamic node-state rules. When absent, visible and enabled default to true, while readonly defaults to false.",
      "properties": {
        "visible": {
          "$ref": "#/$defs/condition",
          "description": "Condition controlling whether the node is visible. When absent, visibility defaults to true."
        },
        "enabled": {
          "$ref": "#/$defs/condition",
          "description": "Condition controlling whether the node is enabled. When absent, enabled defaults to true."
        },
        "readonly": {
          "$ref": "#/$defs/condition",
          "description": "Condition controlling whether the node is read-only. When absent, read-only defaults to false."
        },
        "required": {
          "$ref": "#/$defs/condition",
          "description": "Condition that dynamically overrides the node's static required property."
        }
      }
    },

    "condition": {
      "oneOf": [
        { "$ref": "#/$defs/pathCondition" },
        { "$ref": "#/$defs/allCondition" },
        { "$ref": "#/$defs/anyCondition" },
        { "$ref": "#/$defs/notCondition" }
      ]
    },

    "pathCondition": {
      "type": "object",
      "additionalProperties": false,
      "required": ["path"],
      "minProperties": 2,
      "description": "Condition evaluated against one path. When multiple comparison operators are present, all operators must evaluate to true.",
      "properties": {
        "path": { "type": "string", "minLength": 1 },
        "equals": { "$ref": "#/$defs/jsonValue" },
        "exists": { "type": "boolean" },
        "in": { "type": "array", "items": { "$ref": "#/$defs/jsonValue" } },
        "greaterThan": { "type": ["number", "string"] },
        "greaterThanOrEqual": { "type": ["number", "string"] },
        "lessThan": { "type": ["number", "string"] },
        "lessThanOrEqual": { "type": ["number", "string"] }
      }
    },

    "allCondition": {
      "type": "object",
      "additionalProperties": false,
      "required": ["all"],
      "properties": {
        "all": { "type": "array", "minItems": 1, "items": { "$ref": "#/$defs/condition" } }
      }
    },

    "anyCondition": {
      "type": "object",
      "additionalProperties": false,
      "required": ["any"],
      "properties": {
        "any": { "type": "array", "minItems": 1, "items": { "$ref": "#/$defs/condition" } }
      }
    },

    "notCondition": {
      "type": "object",
      "additionalProperties": false,
      "required": ["not"],
      "properties": {
        "not": { "$ref": "#/$defs/condition" }
      }
    },

    "dataReference": {
      "type": "object",
      "additionalProperties": false,
      "required": ["source", "key", "label"],
      "properties": {
        "source": {
          "type": "string",
          "minLength": 1,
          "description": "Opaque source locator, such as $root.countries or datasource:countries. X-Schema does not interpret the locator's storage or transport."
        },
        "key": {
          "type": "string",
          "minLength": 1,
          "description": "Property containing the value stored by the field."
        },
        "label": {
          "type": "string",
          "minLength": 1,
          "description": "Property containing the human-readable label presented to the user."
        }
      }
    },

    "attributes": {
      "type": "object",
      "description": "DOM attributes applied to the rendered component.",
      "additionalProperties": { "type": ["string", "number", "boolean", "null"] }
    },

    "properties": {
      "type": "object",
      "description": "DOM/Web Component properties applied directly to the rendered component.",
      "additionalProperties": true
    },

    "meta": {
      "type": "object",
      "description": "Compiler, source or diagnostic metadata ignored by normal rendering.",
      "additionalProperties": true
    },

    "jsonValue": {
      "description": "Any valid JSON value."
    }
  }
}
